,date_commenced,claim,verdict
1113,1976-10-22,last point major uh thrust got ta put people back work,1
1114,1988-09-25,think need remain strong,1
1115,2000-10-11,soon change allows people speak freely wanting develop kind blueprint help like u freedom free market political freedom,1
1116,1984-10-21,well say roundtabled sat chief staff said seems could logical step ultimate goal ultimate dream elimination nuclear weapon world,0
1117,2012-10-16,well katherine great question,1
1118,2004-09-30,opponent say going try change dynamic ground,0
1119,1996-10-06,let look fact,1
1120,1976-10-06,non nu oh uh nonproliferation may l called conference uh nuclear supplier,0
1121,2004-10-08,united state senate year,0
1122,1992-10-15,let first personal level,1
1123,1996-10-06,well blood pressure lower weight cholesterol make health issue campaign,0
1124,2000-10-03,four going say receive federal money measure third fourth fifth sixth seventh eighth grade,1
1125,2016-10-09,gotten see vicious commercial ever seen michelle obama talking hillary,0
1126,2016-10-09,justice scalia great judge died recently,0
1127,2016-10-09,master class watching president lincoln get congress approve th amendment,0
1128,2012-10-03,raise tax kill job,1
1129,1992-10-19,incumbent got look fact,0
1130,1960-10-21,senator kennedy referred vote communist china,0
1131,2012-10-03,say going replace dodd frank wall street reform know exactly one,0
1132,2008-09-26,think much le day,1
1133,2016-10-19,denigrating talking democracy,1
1134,2012-10-22,ended war iraq refocused attention afghanistan deliver surge troop,0
1135,1996-10-16,american job lost,1
1136,2016-10-19,yes need go baghdadi like went bin laden celebrity apprentice brought justice,0
1137,1980-10-28,repeat year opportunity realize produce million ton coal unequaled record history country,1
1138,2000-10-11,would make change,1
1139,2012-10-03,well four year ago running office traveling around conversation governor romney talk,0
1140,2004-09-30,tell president took american force degree coalesce african union prepared could never allow another rwanda,1
1141,2016-09-26,said focus terror also,0
1142,2016-10-19,leader wanted get gone smart,0
1143,1996-10-06,stay firm strong able bring cuba around well,1
1144,2008-09-26,system got cleaned,1
1145,2000-10-03,let make sure senior hear loud clear,1
1146,2012-10-22,next door course egypt,0
1147,1984-10-07,finally,0
1148,2000-10-03,whether force high morale high standing well equipped,1
1149,1976-10-22,gone two congressional committee following investigation committee overwhelmingly approved house senate likewise,0
1150,1992-10-11,told tax budget summit agreed tax increase could balance budget,0
1151,2012-10-22,present threat friend ultimately threat u iran nuclear material nuclear weapon could used u used threatening u,1
1152,2000-10-17,spent last quarter century fighting middle class working men woman united state america,0
1153,1960-09-26,united state standing still,1
1154,2016-10-19,know said done woman,1
1155,1996-10-06,well let say first happy commission deal appreciate senator dole social security commission,1
1156,2012-10-03,ann yesterday rally denver woman came baby arm said ann husband four job three year part time job,0
1157,2008-10-07,got show moral support georgia,1
1158,1992-10-19,never forget got airbus government owned privately owned consortium across europe,0
1159,2008-09-26,difference precondition preparation,0
1160,1996-10-16,know fell platform california chico back,0
1161,2000-10-03,chance work alan greenspan others crisis following collapse mexican peso,0
1162,2016-09-26,laid platform think would begin remedy problem criminal justice system,1
1163,1984-10-21,met son daughter,0
1164,2008-09-26,war started time war started said going quick easy,0
1165,1988-10-13,national park,0
1166,1988-09-25,major problem,1
1167,1992-10-11,china huge country broken many province,0
1168,1976-10-22,mr harriman talked leader yugoslavia think accurate say uh prospect opinion soviet union invading uh yugoslavia uh mr tito pas away,0
1169,2004-10-08,counsel people,0
1170,1996-10-16,say asked u play reasonable role know would respond,1
1171,2012-10-03,experience governor come lay piece legislation say way highway get lot done,1
1172,1996-10-06,thank jim thank mr president thank everyone watching listening,1
1173,1980-09-21,saw high school military,0
1174,1960-10-13,would say prestige high,1
1175,1988-10-13,give farm family decent income spending billion year farm subsidy sure,1
1176,2008-10-15,senator mccain actually agree two thing mentioned,0
1177,2000-10-03,favor testing way measuring performance,0
1178,2012-10-16,lot family good fortune whose son daughter husband survive,1
1179,2012-10-03,statement also say endowed creator right pursue happiness choose,0
1180,2012-10-22,middle east tumult,1
1181,2012-10-03,number two cut spending,1
1182,1960-10-13,strong trigger happy,1
1183,2012-10-22,want economy work world free open,1
1184,2016-10-19,want see deportation force donald talked action country,0
1185,2016-09-26,gang roaming street,0
1186,2012-10-16,said make sure china flooding domestic market cheap tire governor romney said protectionist helpful american worker,0
1187,1992-10-11,disagree mr perot,1
1188,2016-10-09,know every time take rebel whether iraq anywhere else arming people,0
1189,2008-10-15,ok right,1
1190,2016-10-19,insulted former miss universe alicia machado called eating machine,0
1191,2004-09-30,thank university miami say prayer good people state suffered lot,1
1192,2008-10-15,respect partial birth abortion completely supportive ban late term abortion partial birth otherwise long exception mother health life contain exception,0
1193,2000-10-11,support time,0
1194,1960-10-21,one issue stand rest one every american concerned regardless group may member regardless may live,1
1195,2000-10-03,science class supposed student,0
1196,1976-10-22,yes glad,1
1197,2008-09-26,supported ethnic cleansing genocide taking place,0
1198,2000-10-11,thought president made right decision joining nato bombing serbia,1
1199,1992-10-19,going lead way economic recession across world economic slowdown home,1
1200,1996-10-06,closing loophole going big corporation,0
1201,2000-10-03,guy named michael run school,0
1202,2000-10-11,running get thing done america,1
1203,2012-10-16,one reason able get many good woman part team recruiting effort,1
1204,2000-10-11,agree governor bush new accountability testing student,1
1205,2008-09-26,even seal yet,0
1206,2000-10-03,main issue,1
1207,2012-10-16,president characterization tax plan,1
1208,2012-10-22,governor come foreign policy seem want import foreign policy like social policy economic policy,0
1209,1960-10-21,field made recommendation confident move american economy ahead move firmly soundly never time soviet union able challenge superiority field,1
1210,2008-10-15,true senator mccain difference term need invest america american people,1
1211,1984-10-07,change come earlier,0
1212,1960-10-07,criticized failure administration use great influence persuade cuban government hold free election particularly,1
1213,1996-10-06,people experience people understand america people made know hard knock life,1
1214,1988-10-13,vice president talk national security,0
1215,1976-10-22,saw work saw make hard decision,0
1216,2012-10-03,idea taxing people putting people work never get,1
1217,2016-09-26,understand businessperson,0
1218,2012-10-22,happened came office,0
1219,1960-10-07,ought try meet problem,1
1220,1976-09-23,wait one year two year longer governor carter uh indicates,1
1221,2012-10-03,point think american people ask reason governor romney keeping plan replace secret good,1
1222,2000-10-03,think private school right take taxpayer money away public school time caley elli standing classroom,1
1223,1960-09-26,hundred thousand,0
1224,1984-10-07,position hold world live embassy get blown beirut supposed talk debate st understand pose threat several hundred people go church,0
1225,2016-10-09,lost particular well known one muhammad ali,0
1226,2012-10-03,talk,1
1227,1984-10-07,regard social security hope time minute mention say president never say never,1
1228,1996-10-16,visited chrysler dealership japan,0
1229,2016-10-19,used,0
1230,2016-09-26,say certainly relieved late father never business,0
1231,2000-10-17,quota help meet goal ownership small business example,1
1232,2004-09-30,president talked iraq center war terror,0
1233,2000-10-11,think foreign aid need used encourage market reform,1
1234,1984-10-07,live go bed night thinking true,1
1235,1960-10-21,served uh war,0
1236,2004-10-08,trying attack,0
1237,2000-10-17,big farm state,0
1238,1996-10-16,little foundation disabled called dole foundation,0
1239,1988-09-25,agree mr bush value important,1
1240,2012-10-03,kind policy want want get america energy secure,1
1241,1992-10-11,question,1
1242,2000-10-03,opponent think government surplus government money,1
1243,2012-10-16,call self deportation,0
1244,2000-10-11,well got part current administration right one member political party support former president bush persian gulf war resolution end war whatever reason finished way removed saddam hussein power,0
1245,1976-10-22,governor may heard uh established criterion selection vice president uh well established criterion person selected would fully qualified president united state,1
1246,2000-10-17,young man father senator opposed vietnam war,0
1247,2016-09-26,tell,1
1248,2012-10-16,governor romney different response,0
1249,2008-10-15,also entire life never forgotten came coming scranton fighting behalf working family remembering like see father lose job go downward spiral economically,0
1250,1992-10-11,matter life death,1
1251,2000-10-11,healthy folk healthy young kid say never get sick therefore need health care right,1
1252,1980-10-28,campaigning everywhere went mayor local official despair rapidly deteriorating central city nation,0
1253,2004-10-08,somebody asked question vetoed something,0
1254,2016-10-09,meet people time tell difference insurance meant family,0
1255,1992-10-15,well raised question father good line well rehearsed well delivered,0
1256,2012-10-16,going get aggressive energy policy million job country,1
1257,2012-10-22,day one label currency manipulator allows u apply tariff taking job,1
1258,1992-10-19,think fundamental country know getting,1
1259,1996-10-06,message people watching,1
1260,2016-10-19,well c v heller decision strongly extremely angry,0
1261,1988-10-13,applause politics twenty five year margaret lot election lost know learned loss,0
1262,2008-10-07,senator mccain talk small business,0
1263,1992-10-19,institution house representative everyone yelling clean house,0
1264,2012-10-03,get school competitive,1
1265,2000-10-17,vice president mentioned view long term military,0
1266,1984-10-21,know cia men stationed country world certainly central america,0
1267,2000-10-17,want honor among achievement,1
1268,2016-10-09,hope people check see yes spent year actually maybe little working help kid family,0
1269,1984-10-07,flow import country swamping american people,1
1270,1976-09-23,present bureaucratic structure federal government mess,1
1271,2004-10-08,would ruin quality health care america,1
1272,2008-10-07,went somalia peacemaking organization ended trying excuse peacekeeping organization ended trying peacemaker ended withdraw humiliation,0
1273,2000-10-03,want team,0
1274,2004-09-30,leave failed iraq,1
1275,2000-10-11,case nation building exercise haiti,0
1276,2004-10-13,blame entirely,1
1277,2004-10-08,remember going basement white house day committed troop last resort looking tommy frank general ground asking right plan right troop level,0
1278,2016-09-26,campaign manager patti doyle went campaign campaign president obama fought hard,1
1279,2008-09-26,tell town hall meeting wolfeboro new hampshire woman stood said senator mccain want honor wearing bracelet son name,0
1280,1996-10-16,separate map sign literally thousand delineation would west bank believe party get together good faith manner make agreement able impose peace middle east,0
1281,1984-10-07,tell think outrageous thing political dialog campaign one,1
1282,1992-10-15,believe free fair trade thing saved u,1
1283,2016-09-26,secretary state,0
1284,1976-09-23,never uh end inflationary spiral never balanced budget get people back work,1
1285,2000-10-03,opposed,1
1286,1984-10-07,think american people draw conclusion,1
1287,2008-10-07,fact senator mccain campaign chairman firm lobbyist behalf fannie mae,0
1288,2004-10-08,sorry time diplomacy,1
1289,1988-10-13,said going keep social security entitlement keep trust fund sound,0
1290,2008-09-26,comprehensively though,1
1291,2012-10-16,head epa said build coal plant,0
1292,2012-10-03,going forward status quo going cut american people struggling today,1
1293,1992-10-11,say separate think experience level,1
1294,2008-10-15,let talk one short term fix,1
1295,1988-09-25,senator bentsen plan beyond,1
1296,2004-10-08,want remind administration made decision safety,0
1297,1988-09-25,year old son let son compete sport little league afraid going get hurt able provide health insurance pay bill,0
1298,1988-09-25,think father houston tell youngster play little league ball go ball field afraid going get hurt,1
1299,2012-10-16,president plan,0
1300,2012-10-03,worked way high school education started secretary ended vice president local bank,0
1301,2012-10-16,veteran sacrificed country,1
1302,1960-10-21,talked american ambassador,0
1303,1984-10-21,said number occasion exactly believe soviet union,1
1304,1976-10-06,hope mr ford either,1
1305,2012-10-16,said first year put immigration plan would deal immigration challenge,0
1306,2016-10-19,voted senator think case,0
1307,1984-10-07,done candidate president ever done told election,0
1308,2004-10-08,suggested get brit german french go make clear iranian expect party world give nuclear ambition,1
1309,2016-10-09,locker room talk told,0
1310,1992-10-11,time run much debt time longer friend,1
1311,1960-10-13,well must say uh mr truman uh method expressing thing politics fifty year president united state,0
1312,1996-10-16,let look fact,1
1313,2000-10-17,argued reverse trend take back,0
1314,2016-10-09,injured turned light powered factory,0
1315,1988-10-13,something want lead something course past many year even though vice president least allegedly charge war,1
1316,2000-10-03,,1
1317,1992-10-15,glad respond,1
1318,2016-09-26,taken home page website hillaryclinton com turned fact checker,0
1319,2012-10-22,made sure isolated,0
1320,1984-10-21,force includes syria mind want u succeed want kind peace dominant lebanon dominant territory,1
1321,1976-09-23,think real issue campaign must decide november second whether vote promise performance two year white house,1
1322,2012-10-16,candy job going come back,1
1323,1988-09-25,know people pick make enormous difference ability govern set high standard,1
1324,1996-10-16,longview texas day met woman almost tear able keep job spending time husband cancer,0
1325,1992-10-19,got notice,1
1326,2000-10-03,mr greenspan thought missed opportunity say third way get better rate return social security monies coming trust,1
1327,2000-10-03,think fair price pay destroy precious part america environment,1
1328,2000-10-03,told criterion appoint judge,0
1329,1992-10-19,call sequester,1
1330,1996-10-06,always disagree,1
1331,1992-10-11,phase industry whole intellectual talent industry,1
1332,2016-10-09,think look letter get lot people worried maybe place donald trump america,0
1333,1960-10-21,engaged debate whether war mean communizing world whether use subversion infiltration economic struggle rest,0
1334,2008-10-15,true friend supporter warren buffett example could afford pay little tax order,0
1335,1976-10-06,would restore concept fireside chat integral part administration franklin roosevelt,0
1336,2004-10-13,health care program end line item federal government budget lead control,1
1337,2016-09-26,built unbelievable company,0
1338,1960-10-07,incidentally point senator kennedy attacked foreign policy,1
1339,2012-10-22,nothing could truth,1
1340,2004-10-13,bob regrettably moved far enough along,1
1341,2004-09-30,american military force nearby field use best trained troop world go kill world number one criminal terrorist,0
1342,1996-10-06,carry little card pocket called tenth amendment,0
1343,1960-10-21,support president position,1
1344,2016-10-19,feel absolutely important uphold fact trauma,1
1345,2016-10-09,think would serious mistake,1
1346,2012-10-16,tax saving,1
1347,2016-10-09,expect able implement,1
1348,2004-10-08,abroad war,0
1349,2012-10-03,fact wrong said president proposing change current retiree,0
1350,2016-09-26,going stop,1
1351,2012-10-03,know path taking working,1
1352,2012-10-03,right answer government say make private sector become efficient effective,1
1353,2012-10-22,get u track balanced budget,1
1354,1992-10-15,since suggested format hope good,1
1355,2012-10-22,say talking middle east help middle east reject kind terrorism seeing rising tide tumult confusion,1
1356,2008-09-26,said store safely,0
1357,2004-10-13,shop steward stand say promise going stop outsourcing,0
1358,1988-09-25,wrote anti terrorist report government,0
1359,1984-10-07,military morale high,1
1360,2000-10-03,throughout career public service fought working men woman country middle class family,0
1361,1992-10-19,want lowest low,1
1362,2008-10-15,want focus early childhood education providing teacher higher salary exchange support,1
1363,1980-10-28,noticed recently governor reagan frequently quote democratic president acceptance address,0
1364,1976-09-23,efficiency simplicity uh ability people understand government control uh substantial benefit derived complete reorganization,1
1365,2016-10-19,big proponent,1
1366,2000-10-11,make sure society hopeful possibly every single child america must educated,1
1367,2016-10-19,going make america great,1
1368,2004-10-13,nation ever veto u,1
1369,2004-10-13,gotten flu shot intend want make sure vulnerable get treated,0
1370,1988-09-25,think,1
1371,1996-10-06,fact fell podium chico lit ground hit ground call cell phone trial lawyer saying think got case,0
1372,1988-09-25,seen authoritatively written twice done injustice say sorry,1
1373,2016-10-19,new hampshire day,0
1374,2008-10-07,conversation,0
1375,2004-09-30,got show serious regard,1
1376,1980-10-28,notice governor reagan recently mentioned reagan kemp roth proposal,0
1377,2016-10-09,say way want say bill clinton abusive woman,1
1378,2000-10-03,ingenuity eight year ago,0
1379,2000-10-03,man tonight named george mckinney milwaukee,0
1380,2012-10-03,lot point want make tonight important one year ago became luckiest man earth michelle obama agreed marry,0
1381,2016-10-09,take look mosul,1
1382,2004-09-30,get casualty report every day,0
1383,1976-09-23,think gave good opportunity think go,1
1384,1996-10-06,look poor people still live cuba,1
1385,1992-10-15,talking early childhood education disadvantaged little child,0
1386,2016-10-19,million people right way,0
1387,2016-10-19,mosul sunni city,0
1388,2000-10-03,one important way looking ask going fight,1
1389,1976-10-06,uh mr brezhnev met vladivostok december purpose trying take initial step could salt ii agreement would go l,0
1390,1960-09-26,many point made would like comment upon,1
1391,2012-10-16,spent time said prayer remarkably two month later young man mom showed looked unbelievable good new,0
1392,2000-10-03,senior covered poor senior prescription drug paid meantime plan help poor senior meantime could one year two year,1
1393,2016-10-09,ordinary time ordinary election,1
1394,2016-10-09,divided nation people like believe tremendous hate heart,1
1395,2004-10-13,plenty people standing line become citizen,0
1396,1980-09-21,man tonight respond charge chose attend,0
1397,2000-10-11,happen believe strongly marriage man woman,1
1398,1984-10-21,believe idea amnesty put root lived even though sometime back may entered illegally,1
1399,1996-10-06,fight much money,1
1400,2016-10-09,let tell president united state nothing going happen,1
1401,1980-10-28,typical long standing inclination use american power resolve dispute diplomatically peacefully show exercise military power best proven actual use,1
1402,2008-09-26,afraid senator obama understand difference tactic strategy,1
1403,1960-09-26,cabinet,0
1404,1992-10-15,say something,1
1405,1996-10-06,proved sign reasonable tort reform,1
1406,2012-10-03,magnitude tax cut talking governor would end resulting severe hardship people importantly would help u grow,1
1407,2012-10-22,make point kind clarity leadership decision always popular,0
1408,1992-10-19,spent whole adult life close military,0
1409,1960-10-07,secondly mentioned problem older citizen,0
1410,1992-10-19,law violated much suggest somebody represents foreign country anything make corrupt taxpayer agree,1
1411,1996-10-06,discussing whitewater,1
1412,2016-10-09,catastrophic certain way,1
1413,1992-10-19,going running ad pretty soon show promised u going hold line spending tax budget summit going show much increased little stuff,1
1414,1992-10-11,still thing,0
1415,2000-10-03,care child,1
1416,2016-09-26,proud,1
1417,2016-09-26,take anything table,1
1418,1984-10-07,want understood beginning open door stronger olympics,1
1419,1996-10-16,said would hurt economy,0
1420,2012-10-03,also want close loophole giving incentive company shipping job overseas,1
1421,1992-10-15,american people beginning vote across racial line hope happen,0
1422,2004-10-08,going president belief science,1
1423,2012-10-22,widely reported drone used drone strike support entirely feel president right usage technology believe continue use continue go people represent threat nation friend,0
1424,2016-10-19,well mentioned debt,0
1425,1996-10-16,proposed budget would put ten year life medicare trust fund,0
1426,2000-10-03,general strike going,0
1427,2016-09-26,paid zero mean zero troop zero vet zero school health,1
1428,1976-10-06,last two year made policy decision involving long range difficulty policy made day day judgment president united state leader free world result leadership,0
1429,1976-10-22,nomination going street barbershop beauty parlor restaurant store factory shift line also farmer market livestock sale barn talked lot listened lot learned american people,0
1430,1996-10-06,like like senator dole probably tell like,1
1431,2012-10-03,get growth balance budget,0
1432,1992-10-11,senior official federal government spending billion dollar taxpayer money mature individual make mistake ticket,1
1433,1980-10-28,window smashed painted one unkept promise another despair,0
1434,2004-10-13,hear plan fix social security,0
1435,2008-09-26,let go back original point,1
1436,1976-09-23,one major issue campaign trust,1
1437,2004-10-13,fact people middle east allegedly coming across border,0
1438,2000-10-11,think require state test student test school school district think go require teacher testing new teacher also,1
1439,1996-10-06,first take full responsibility happened somalia american people must remember soldier american commander happened,1
1440,2008-09-26,energy independence put forward plan make sure year time freed dependence middle eastern oil increasing production home importantly starting invest alternative energy solar wind biodiesel making sure developing fuel efficient car future right united state ohio michigan instead japan south korea,1
1441,1960-10-21,want stronger,1
1442,1988-09-25,difficult fundamental decision u make,1
1443,2004-09-30,thought would stay fight,1
1444,2008-09-26,yet know tax revenue going,1
1445,1996-10-16,think answer,1
1446,2008-10-15,got,1
1447,1976-10-06,nobody except president served long time secretary state,0
1448,1976-10-06,shift emphasis disturbing speaking middle east,1
1449,2016-10-09,well one thing get rid carried interest,1
1450,1996-10-16,time want get medicare get back mainstream going provide job,1
1451,2008-09-26,wind tide solar natural gas flex fuel car also offshore drilling also nuclear power,1
1452,1992-10-19,got proceed carefully,1
1453,1996-10-16,important question,1
1454,2016-10-19,lied said call gold standard one debate,0
1455,2016-10-09,going famous thing going answer call clock morning,1
1456,1960-09-26,well comparison make,1
1457,1976-10-06,accomplished helsinki agreement,1
1458,1996-10-06,never could dreamed anything like would come way life done best faithful charge given,1
1459,2008-10-07,grew family father gone time sea country business,0
1460,2012-10-03,saying cutting rate,0
1461,2004-10-13,lewin report group folk politically affiliated,0
1462,1996-10-06,drunk driver money,0
1463,1992-10-19,anybody else run middle class run economy ditch,1
1464,2000-10-11,claim know heart,0
1465,2012-10-22,ship go underwater nuclear submarine,0
1466,2004-10-08,save manpower save equipment,1
1467,1988-10-13,incredibly powerful nuclear deterrent,1
1468,2004-10-08,looked eye said yes sir mr,0
1469,2000-10-03,pay prescription drug one go canada regularly order get prescription drug,0
1470,1996-10-16,finally gave,0
1471,1996-10-16,supported character education program school drug free school program,0
1472,2008-09-26,yes went back washington met republican house representative,0
1473,1984-10-21,matter fact believe every one standard essential exercise power country,1
1474,2016-09-26,kind thing really boost economy,1
1475,1980-10-28,obvious still long way go fully incorporating minority group mainstream american life,1
1476,2016-10-19,year position help say use steel use something else make impossible,0
1477,2008-09-26,waiting seize opportunity,1
1478,2000-10-11,think got many example around country really find way end,1
1479,2012-10-22,even party including current vice president critique,0
1480,2016-10-09,facebook twitter almost million people,0
1481,2004-10-08,show lack understanding,1
