,date_commenced,claim,verdict
0,1984-10-07,question agriculture came minute ago,0
1,1996-10-16,instead federal government tax credit pick cost hire replacement worker cost,1
2,1984-10-21,give demonstration say,1
3,2012-10-03,used consult business excuse hospital health care provider,0
4,2016-10-09,united state united state senator,0
5,2000-10-17,dingle norwood bill,1
6,2004-09-30,say one focus war terror really understand nature war terror,1
7,2004-09-30,see beheading,0
8,1996-10-06,raise tax nobody run around asking people going get extra money,1
9,2012-10-22,tell time make sure look happening pakistan recognize happening pakistan going major impact success afghanistan,1
10,2004-10-08,talked find serious really holding saddam hussein accountable,0
11,2004-09-30,close border,1
12,2016-10-19,think going,1
13,2016-10-19,overturned go back state,1
14,2000-10-03,broke heart go flood scene del rio fellow family got completely uprooted,0
15,2000-10-11,well one trouble explaining,0
16,2012-10-16,making life miserable folk leave,1
17,2012-10-22,way make sure understand beginning tightest sanction possible,1
18,1988-09-25,governor wife active homeless,0
19,1988-09-25,know sam rayburn said two people agree everything one person thinking,0
20,2016-10-19,get shot walking store,0
21,1976-10-22,one major responsibility shoulder uh new york city finance welfare,0
22,1988-09-25,people country,0
23,1988-09-25,yet finest president strongest international leader governor franklin roosevelt woodrow wilson theodore roosevelt,0
24,2008-09-26,tom john mentioned wildly liberal,0
25,1988-10-13,teddy roosevelt used talk arena know daring fail greatly succeed matter,0
26,2016-09-26,first agree lot people even within party want give certain right people watch list fly list,0
27,1960-09-26,connection think uh must look future mind fact fight communism home law deal communist uh become communist become tra fellow traveler also fight communism home moving various injustice exist society communist feed upon,1
28,1976-10-22,background different,0
29,1996-10-16,even cardiologist quota,1
30,2004-10-08,republican chairman word,0
31,1996-10-06,stop admit,0
32,2016-09-26,much le,0
33,2016-10-09,absolutely apologize word,1
34,1984-10-21,go detail,1
35,1992-10-11,occur young person formative year,1
36,1992-10-19,lot decent honorable people felt draft,0
37,2000-10-17,know parent worried filter ask kid put,0
38,2016-10-19,waiting year,1
39,2000-10-17,want somebody willing fight asking support vote yes confidence willingness believe right thing america better,1
40,2016-09-26,war started,0
41,1976-10-22,state senate governor engineer naval officer farmer businessman,0
42,2012-10-03,reality wealthy people mentioned donald trump,0
43,1960-09-26,want talent american go waste,1
44,1992-10-19,want new program country,1
45,2004-09-30,iran iraq dangerous iran north korea dangerous,1
46,1996-10-06,favor started,1
47,2008-10-07,going help lower premium,1
48,2016-10-19,fact said last job report election,0
49,1996-10-06,know think idea better future,1
50,1960-10-07,giving aid school technically trying carry decision great question,1
51,2000-10-03,think ought support decision,1
52,2000-10-03,fundamental difference opinion,1
53,1960-10-21,believe sixty one two three rendezvous destiny,1
54,1996-10-06,mean want stop coming across border,1
55,2008-10-15,senator obama president bush,0
56,2008-10-07,senator mccain mentioned looking record,0
57,1996-10-06,think ought lifting moving child forward,1
58,2004-10-13,west texas painting painting mountain scene,0
59,1992-10-15,need year economic theory work,1
60,2004-10-08,going get ally back table,1
61,1976-10-06,graduate u,0
62,1992-10-19,see margaret tutwiler sitting today,0
63,2008-09-26,senator obama refuse acknowledge winning iraq,1
64,2016-09-26,think look strongly fly list watch list,1
65,1996-10-06,well saying senator dole said fine speech san diego wanted build bridge past,0
66,1980-09-21,believe much additional money take pocket people,1
67,2000-10-03,chance vice president eight year nothing done,0
68,1992-10-19,look around see first class strong woman,0
69,2012-10-22,done last four year,0
70,1980-10-28,first like thank league woman voter making debate possible,1
71,1988-09-25,continuing evolve evolving favor life,1
72,2004-09-30,called coerced bribed,0
73,1996-10-06,feel strongly lot thing,1
74,1960-10-21,communist dictator inherited previous administration,0
75,2004-10-13,opponent senator talk foreign policy,0
76,2012-10-22,came home wanted become nurse start scratch,0
77,1992-10-15,question maybe get wrong,1
78,2000-10-03,remember going del rio texas,0
79,2016-09-26,go list defend japan defend germany defend south korea defend saudi arabia defend country,0
80,1988-09-25,asked received briefing,0
81,2008-10-07,let let talk fundamental difference,1
82,1996-10-06,well first jim let thank thank senator dole thank lady gentleman listening tonight chance given u appear,1
83,2016-09-26,land laguardia land kennedy land lax land newark come dubai qatar see incredible come china see incredible airport land become third world country,0
84,2008-09-26,energy bill united state senate,0
85,2012-10-22,know killed bin laden ground zero memorial talked young woman four year old happened,0
86,1992-10-15,put term limit reform government get benefit thought,1
87,1988-10-13,great success state,0
88,2000-10-03,agree couple thing education,0
89,1992-10-19,governor clinton keep hitting vetoing legislation,0
90,1992-10-15,washington post ran long editorial today saying believe mr bush making character issue said greatest quote political chameleon changing position time,0
91,2004-09-30,left planning state department state department desk,0
92,1996-10-16,see scandal almost daily basis,1
93,2004-10-13,record fighting fiscal responsibility,0
94,2004-09-30,part leadership sending right message place like north korea,1
95,2008-10-07,important understand think american people hungry kind leadership going tackle problem government outside government,1
96,2016-10-09,said awake,0
97,1960-10-13,would hope different monetary policy would possible reduce interest rate burden least billion dollar,1
98,1992-10-11,united state america,0
99,1992-10-15,much care,1
100,1984-10-07,remember distinctly segueing another subject,1
101,1976-10-22,tremendous surge patriotism want make sacrifice country,1
102,2000-10-03,said poor senior,0
103,2012-10-16,going make sure,1
104,2016-10-19,really glad premium started least people see happening want keep obamacare want make even worse get worse,0
105,2016-09-26,mind releasing routine audit,0
106,1976-09-23,seen uh federal energy agency established instance,0
107,1992-10-11,want help somebody run cost making doctor test one would fear sued somebody along highway stop pick guy help afraid trial lawyer come along sue,1
108,2008-10-07,president united state alan would order secretary treasury immediately buy bad home loan mortgage america renegotiate new value home diminished value home let people able make able make payment stay home,1
109,2000-10-17,providing health care people,0
110,1992-10-15,policeman world longer,1
111,1988-10-13,year ago young man graduated law school came city came clear across country watch john kennedy nominated presidency united state right los angeles,0
112,2004-10-13,fellow american heard bob schieffer moment ago america tested division,0
113,2016-10-09,said irredeemable irredeemable mention said irredeemable might even worse,1
114,1996-10-16,better idea,1
115,1984-10-21,number thing weakened bill,1
116,1992-10-19,think answer slow economy drive unemployment undermine health private sector,1
117,1992-10-15,wanted said year,0
118,1996-10-06,talk smaller government,0
119,2016-10-19,well aware really legitimate concern expressed president general,0
120,2008-09-26,senator obama said would provocative,0
121,2000-10-11,let say mr vice president happy law book,0
122,1980-10-28,one major war explosion warhead,1
123,1984-10-07,think u called upon stand make decision thing might come self defense tradition,1
124,1988-09-25,still couple minute left,0
125,2000-10-17,graduated college plenty fancy way get going part,0
126,1984-10-21,part requires employer determine citizenship employee hired,0
127,2000-10-03,want strong hand come united state world affair,1
128,1996-10-06,gave four five specific example congress said prove people could recover going eliminate frivolous lawsuit sign bill,0
129,1976-10-22,governor georgia four year,0
130,2004-10-13,said ok got deal,0
131,2008-10-15,bill ayers professor education chicago,0
132,1960-09-26,mine executive branch,0
133,1976-09-23,tax incentive low income group could build uh income level uh poverty level uh make welfare uh profitable work,1
134,2016-09-26,recent troubling russia,0
135,2004-10-13,account allow somebody buy low premium high deductible catastrophic plan couple tax free saving,0
136,2012-10-22,believe want make sure relationship friendship people take place step year come see syria friend syria responsible party middle east,1
137,2008-10-07,fine,1
138,1992-10-19,story today yesterday washington post economic program chief budget officer chief economic officer african american even though post mention think sign progress,0
139,2012-10-22,started build afghan force,0
140,1988-09-25,want see bank let hook,1
141,1980-10-28,listening voice make judgment future country,1
142,2000-10-03,want focus result,1
143,2012-10-16,built world greatest middle class,1
144,2000-10-03,fact last year congress faced lot opposition,1
145,2004-10-08,argued fully funded,0
146,2004-09-30,happened long arrived washington c,0
147,1988-09-25,think one thing mr bush said mr reagan back,0
148,2004-09-30,well know talked billion made mistake talk war,0
149,2016-09-26,doubt problem iran,0
150,1992-10-19,grew block arkansas,0
151,2012-10-16,five million job even keep population growth,0
152,1996-10-06,thank goodness republican congress,0
153,1976-10-06,governor carter talking broad generality,0
154,2000-10-11,friend phyllis hunter,0
155,1976-10-06,time make certain soviet union backfire claim intercontinental aircraft people contend must also included get kind agreement best interest country,1
156,2008-09-26,general petraeus invited senator lindsey graham attend ceremony brave young american whose enlistment expired reenlisting stay fight iraqi freedom american freedom,0
157,2012-10-22,exactly going,1
158,1980-10-28,h l mencken said every problem simple answer,1
159,2012-10-03,want cost job,1
160,2008-10-15,balance budget,1
161,2004-10-08,got sneak peek search allowed,0
162,2000-10-17,believe future nation depends upon whether break barrier used pit group group bring people together,1
163,1980-10-28,inflation people living well,1
164,1992-10-11,well better,1
165,1988-09-25,integrity stability get job done fellow american man ask support,1
166,1976-10-06,tough cross examination type press conference thirty day,0
167,1960-10-07,believe election trying determine lead free world america perhaps senator kennedy already indicated important election history label wear wear count,0
168,2008-09-26,pulled nonproliferation agreement,0
169,2000-10-03,year old high blood pressure wife heart trouble,0
170,2012-10-22,latin america huge opportunity u time zone language opportunity,1
171,1996-10-06,inspection,0
172,2008-09-26,series recommendation recall,0
173,2012-10-16,came small business,0
174,1980-09-21,spoke multitude tongue,0
175,1996-10-16,average person benefitting,0
176,1960-09-26,mr nixon come republican party,0
177,1992-10-11,honor service world war ii honor mr perot service uniform service every man woman ever served including admiral crowe chairman joint chief supporting,0
178,1984-10-07,trying provide leadership election american people participate decision,1
179,2016-10-19,free fair election,0
180,1976-10-22,always agree decision whether democratic republican president,0
181,1960-10-07,mr morgan suggested united state felt could save summit conference would proper u expressed regret,0
182,2012-10-16,named amazing woman job man year found getting paid le supreme court said bring suit found earlier whereas way finding,0
183,1992-10-11,therein best answer,1
184,2016-09-26,happen think double,1
185,2000-10-17,tipper good friend mel randy know u want extend sympathy condolence jean family sifford family,0
186,2012-10-16,never got college education even though smart whip,0
187,1992-10-19,heard gov clinton congratulate u thing first time said something pleasant administration,0
188,1992-10-11,convert potato chip airplane emergency,1
189,1960-10-21,arm parley winston churchill said ten year ago,0
190,2008-10-07,let community health center,1
191,1960-10-21,threatens freedom world,1
192,1976-10-06,believe ought,1
193,2004-09-30,also laid strict series thing needed order proceed position strength,0
194,2008-09-26,muddle stamping taliban,1
195,2012-10-16,problem china,1
196,2000-10-11,could get agreement maybe could pas final day congress,1
197,1984-10-21,stake space satellite,1
198,2000-10-03,guy served u lunch gave letter today,0
199,2004-09-30,tell day went war started principally united state america great britain one two others,1
200,2016-10-19,looking anything,0
201,2004-10-13,result president taking eye osama bin laden,1
202,2008-10-15,fact gotten pretty tough,1
203,2004-10-13,view service back door draft,0
204,2012-10-03,time end,1
205,2012-10-03,part way give tax break company shipping job overseas,1
206,2004-10-08,went new york,0
207,2000-10-03,say voluntary testing,0
208,1996-10-16,hit ground cell phone rang trial lawyer said think got case,0
209,2016-10-09,even know rebel,0
210,2004-10-13,came washington solve problem,0
211,1996-10-06,think look result know plan laid future good chance enacted give chance build bridge st century,1
212,1992-10-15,tell affected,1
213,2012-10-16,virtually virtually impossible given regulation,1
214,2004-10-13,result securing ridding taliban afghanistan afghan people election weekend,0
215,2012-10-03,despite said yes take initial emergency measure make sure slip great depression also said let make sure cutting thing helping u grow,0
216,2012-10-22,convince international community pursuing nuclear program,0
217,1960-10-07,wrong something,1
218,1960-10-13,one thing noted traveled around country tremendous number child come see presidential candidate,0
219,1992-10-19,forthcoming,1
220,2012-10-16,fact employer looking skilled worker,1
221,2004-10-13,education make sure got workforce productive competitive,1
222,2004-09-30,secondly think another round resolution would caused saddam hussein disarm disclose ludicrous judgment,1
223,1992-10-19,well believe town hall meeting started campaign new hampshire,0
224,1976-10-06,successful portugal year ago looked like great possibility uh communist would take portugal,0
225,1976-10-06,naval academy first military graduate since uh eisenhower,0
226,2000-10-03,public service year jim,0
227,2004-10-08,country,0
228,1960-10-07,leaf hundred mile sea,0
229,2016-09-26,bring excuse,1
230,2012-10-03,never balance budget raising tax,1
231,2000-10-03,incidentally know value making sure troop latest technology,1
232,2016-09-26,tell fight isi website,0
233,2008-10-15,lot people including said look,0
234,2012-10-16,said e verify portion arizona law portion law say employer could able determine whether someone illegally illegally model nation,0
235,2016-10-09,really owe apology,1
236,2008-10-15,respect acorn acorn community organization,0
237,2004-10-08,talking plan keep job,0
238,1976-10-06,karl marx said free enterprise system democracy continue exist war preparing far war,0
239,1976-10-06,uh look picture bleakly indicated question mr trewhitt,1
240,2004-10-13,said cut pell grant,0
241,2016-10-09,,1
242,2016-10-09,believe saying guess politician,1
243,2008-09-26,doubt going able everything think need done,1
244,1996-10-16,tax credit employer,0
245,2016-09-26,new york new york done excellent job,1
246,2004-10-08,happen ask one thing join rolling back president unaffordable tax cut people earning year,1
247,1980-10-28,said man size misery index right seek reelection presidency,0
248,1992-10-19,went way obvious complete disagreement done company,0
249,2000-10-17,support national patient bill right,1
250,1992-10-15,program includes crime find kind great plan lying around never get enacted law implemented,0
251,1984-10-21,groucho marx said believe,0
252,1988-10-13,fine research top doctor national institute health working hard something research disease aid,0
253,2004-09-30,think need president credibility bring ally back table necessary make america alone,1
254,2012-10-16,got three part time job,0
255,1996-10-06,know president reminds sometimes brother kenny longer alive,0
256,2016-09-26,independent hacking group mostly commercial reason try steal information use make money,0
257,2016-10-19,never get anything done naturally wall built,1
258,1992-10-15,feel think right kind campaign reform get change want,1
259,1960-10-13,pas message,1
260,2016-10-09,question supreme court,0
261,1960-10-13,well que mr griffin believe head klan life tampa florida indicated statement think two three week ago going vote going vote mr nixon,0
262,2000-10-03,interesting issue northwest well,1
263,2008-10-07,notice start talking government,0
264,2004-10-13,next four year continue work make sure health care available affordable,1
265,1960-10-07,must use weapon purpose combating recession come,1
266,1976-10-06,committed one portsmouth ohio,1
267,1996-10-06,respect presidency,1
268,2012-10-22,would gone,1
269,1996-10-06,reached people life,0
270,2000-10-03,may blame folk time get somebody washington going work republican democrat get positive thing done come senior,1
271,1996-10-16,think important thing emphasize though also help people way build strong economy tax cut paid,1
272,2008-10-15,important point though american people become cynical politics see tit tat back forth,1
273,1996-10-16,talk economy,1
274,1992-10-19,horace greeley said thing endures character,0
275,2016-09-26,bring back job,1
276,2000-10-11,energy price high guess advocating big energy tax right,0
277,1984-10-21,call president commander chief,0
278,1960-10-13,done much thought deliberation,1
279,2008-10-07,worked way,1
280,1980-09-21,well see gallon tax applied gasoline would changed price gasoline,1
281,2008-10-07,temper decision ability beneficially affect situation realize sending america precious asset american blood harm way,1
282,1992-10-19,keep mind factory worker nothing anything except putting together factory floor,0
283,2004-10-13,manufacturing job credit,0
284,1992-10-15,everybody running incumbent,0
285,1984-10-21,going exploit political purpose opponent youth inexperience,1
286,1996-10-16,social security going retire,1
287,1960-09-26,pointed came congress year,0
288,1996-10-06,maybe bushnell memorial lot money people watching tonight couple kid working family four five month day care maybe personal computer may three four month mortgage payment,0
289,2004-10-08,going add active duty force military going make people feel good safe military overextended going run foreign policy actually president reagan president eisenhower others,1
290,2012-10-16,get rid,1
291,2012-10-22,one company make valve process industry said look valve coming broken repair warranty looked serial number,0
292,2016-10-09,congressional medal honor recipient endorsed,0
293,1960-10-21,stand still appoint people ambassadorship position washington status quo outlook recognize revolutionary time united state maintain influence,1
294,2008-10-15,make popular teacher union,0
295,2012-10-22,important course,1
296,2012-10-03,think five second interrupted,0
297,1960-10-07,sure belief deeply move way,1
298,1984-10-21,indeed side virtually throughout year senate,0
299,1996-10-16,think need go back take look,1
300,2004-10-13,running president happens catholic,0
301,2008-09-26,number two got make sure taxpayer putting money risk possibility getting money back gain market market return,1
302,2004-09-30,job,1
303,2000-10-03,payroll tax money,0
304,2000-10-17,went united state senate asked assignment armed service committee,0
305,1984-10-07,social security nothing balancing budget erasing lowering deficit,1
306,2004-10-08,also going talk respond asked cheryl time,1
307,1988-10-13,think people took u back space rick houk crew people worthy,0
308,2012-10-22,said occasion america dictated nation,0
309,2004-09-30,belief freedom iraqi people,0
310,2016-09-26,look going charlotte city love city investment look going throughout various part country whether mean keep naming day long need law order country,0
311,2016-10-19,long term health care driver,1
312,1996-10-06,oriented toward future,1
313,1988-10-13,question saying budget full lot waste,1
314,1976-10-06,ability fight necessary best way avoid chance requirement fight,1
315,1996-10-06,lawyer like lawyer,0
316,2008-09-26,see tough terrain,1
317,2016-09-26,would like everybody end get rid,1
318,2016-09-26,voted,0
319,2016-09-26,got give birth certificate,0
320,1992-10-15,fact fix,1
321,1984-10-21,president must also vision nation go,1
322,2016-10-09,finished,0
323,2012-10-22,president iraq excuse iran ahmadinejad say debt make u great country frightening thing,0
324,1996-10-16,took comment always ten thousand comment ought,0
325,2012-10-16,purpose put place imagine,1
326,2012-10-22,governor one thing,1
327,1960-09-26,program expand educational opportunity give american equal chance education thing necessary dear heart people,1
328,1976-09-23,mr ford uh misquoted ap uh news story error begin,0
329,2004-10-13,hunt osama bin laden,0
330,1992-10-15,think taxed much,1
331,1996-10-06,nobody suggested sending troop iraq hint president,0
332,2008-10-07,want say everything ever learned leadership learned chief petty officer,0
333,2000-10-11,thought strategic interest keep milosevic check relation nato took position took,1
334,2016-09-26,able country,1
335,1992-10-15,favor strict control much spend running congress strict limit political action committee requirement people running congress appear open public debate like,1
336,1976-09-23,democratic congress today fortunately republican president check excess veto,0
337,2000-10-17,discover great new cure great,0
338,2004-10-13,said say believe president broke faith american people way took nation war,0
339,2000-10-03,put real asset social security system,1
340,2016-10-09,going fact fact lying said know e mail fine,0
341,2004-10-13,put people behind bar rest life,0
342,2004-10-08,united nation effective removing saddam hussein,1
343,1996-10-06,think present position would true grateful,1
344,2008-10-15,initiated actually support charter,1
345,2016-10-19,three month ago started reading want get leader going attack mosul,0
346,2004-09-30,support u n effort,0
347,1992-10-15,got say got,1
348,2012-10-16,going bring pipeline canada,1
349,1984-10-21,know nothing,0
350,2004-10-13,child across country health care,0
351,2008-10-07,happens washington,1
352,2008-10-15,depression era thing called home ownership loan corporation,0
353,2004-09-30,son bryan came see,0
354,1992-10-15,put everybody breathing work,1
355,1960-10-21,general twining january fifty nine described position united state,0
356,2008-09-26,done work term securing potential target still long way go,1
357,2004-09-30,number one african union providing give logistical support,1
358,1988-10-13,came told truth brilliant book hope actually happening cuba,0
359,2016-09-26,look nato asked major show think nato,0
360,2000-10-03,surely nation come together promote value life,1
361,2012-10-16,talk small business across country,0
362,1960-10-13,stand secretary state mr herter said island indefensible,0
363,1996-10-16,got lot relative good average middle class hardworking american,0
364,2004-10-13,exactly,1
365,2008-09-26,point prevail afghanistan need new strategy need succeed,1
366,2008-10-15,got get financial package working much quicker working,1
367,1988-10-13,ought go program ought review first,1
368,2016-10-09,slogan campaign stronger together think work together overcome divisiveness sometimes set american one another instead make big goal set forth big goal getting economy work everyone top making sure best education system preschool college making affordable much else,1
369,2008-09-26,mean mission succeeds like young people enlisted baghdad like mother met airport day whose son killed,0
370,2016-09-26,met bibi netanyahu day,0
371,2004-10-13,committee chaired late senator daniel patrick moynihan new york democrat,0
372,2000-10-17,wish knew law would darn sure sign,1
373,1984-10-21,evening talked national strength,0
374,2000-10-11,trying allege hard hearted person care child absolutely wrong,1
375,1992-10-19,guard like secret atomic bomb literally,0
376,1992-10-11,best help short term job retraining thrown work defense plant,1
377,1980-09-21,went cite three issue platform totally ignore atomic warfare presidential directive notwithstanding,0
378,2008-10-15,conversation joe plumber essentially said five year ago position buy business needed tax cut,0
379,1988-09-25,well massachusetts furlough program unique,0
380,2000-10-11,may different approach,1
381,2004-10-13,remember campaign people said george w get elected check taken away,0
382,1984-10-07,son methodist minister,0
383,1984-10-21,morton criticize president undercutting stalwart ally shah iran,0
384,2012-10-03,seems trend,1
385,1996-10-16,government pay medicare medicaid know important,0
386,2004-10-13,hunt kill capture,1
387,2008-09-26,senator obama chairperson committee oversight nato afghanistan,0
388,2008-10-15,got going cost loss,0
389,2012-10-22,never said would liquidate,0
390,1988-09-25,mr bush right two go hand hand,1
391,2012-10-03,know grandmother know helped raise,0
392,2012-10-03,use something called race top,0
393,1988-09-25,public service love country,0
