,date_commenced,claim,verdict
2250,2008-10-07,going able deal climate crisis solution use fossil fuel create global warming,1
2251,2008-09-26,america still greatest producer exporter importer,1
2252,1992-10-15,yeah suggest american people quality person decided could automatically get nomination either party,1
2253,2000-10-17,want somebody belief better eight year ago ought go back kind policy back emphasizing tax cut mainly wealthy man,1
2254,2008-10-15,would like mention couple day ago senator obama ohio encounter guy plumber name joe wurzelbacher,0
2255,2004-10-08,need thing coordinate fbi cia,1
2256,2012-10-03,well commission bipartisan commission talked move forward suggested balanced way revenue spending cut,0
2257,1988-10-13,two one congress blamed deficit,0
2258,1960-09-26,first think well put perspective really stand regard soviet union whole matter growth,1
2259,1988-09-25,let talk housing question,1
2260,2004-09-30,enemy attacked u,0
2261,1976-10-22,remember headline daily news said ford new york drop dead,0
2262,1960-10-07,well think illusion whatever responsibility american people sixty,1
2263,2012-10-03,governor romney say replace going repeal replace something,0
2264,1992-10-11,think quickly,1
2265,2016-10-09,say making deal,1
2266,2004-10-08,say going fiscal conservative sudden,0
2267,2012-10-03,restore billion medicare,1
2268,2016-10-19,immediately heard questioned questioned nato,1
2269,1992-10-11,said really upset establishment washington going inform people detail issue electronic town hall really know going,0
2270,2008-09-26,time bin laden still reconstituted,0
2271,1984-10-21,suddenly somebody say oh got star war forth,0
2272,2000-10-11,depends say future campaign,1
2273,1996-10-16,day help decide lead country next century,0
2274,1980-10-28,sure mean steadily higher fuel cost believe nation portrayed long time people energy poor energy rich,1
2275,2004-10-13,cdc responsible health united state setting priority allocating flu vaccine accordingly,0
2276,2012-10-16,greatest failure regard gun violence respect known fast furious,0
2277,2004-10-13,know president kennedy inaugural address told u earth god work must truly,0
2278,2008-09-26,issue aiding pakistan going aim gun somebody george shultz great secretary state told better prepared pull trigger,0
2279,2004-09-30,challenged risen challenge,1
2280,2004-09-30,think misled said know anyone doubted whether world better without saddam hussein power judgment president,1
2281,2000-10-11,society must head going peaceful prosperous society,1
2282,1976-10-22,first organization four five people plus wife child three son wife,0
2283,2012-10-16,think know better,1
2284,2008-10-07,think work three tom,1
2285,1992-10-11,nation would cut defense much already without,1
2286,2016-09-26,well listen heard,1
2287,2008-10-15,everything improve adoption country,1
2288,2012-10-16,lot good people lost job,0
2289,1992-10-11,maybe work,1
2290,2008-09-26,said senator mccain want everything promise one thing everything power make sure son death vain,0
2291,2008-10-15,start campaign identified one top priority think,0
2292,1992-10-15,think press would follow closely probably would get done,1
2293,2012-10-22,glad governor romney agrees step taking,0
2294,2004-10-13,president always respect everybody right practice religion choose practice part america,1
2295,2004-10-13,thumbprint fingerprint technology today,0
2296,1992-10-19,want america trade compete win investing competitive way,1
2297,1984-10-07,whether help know,1
2298,2008-10-07,going sit across table republican democrat ronald reagan tip neill,0
2299,2012-10-22,number two seeing replacement government responsible people critical u,1
2300,2004-10-13,also respect woman respect effort try reach inclusive country,1
2301,2004-10-08,met parent internet gotten armor send kid,0
2302,2008-09-26,wish wrong sake country right case,1
2303,1980-10-28,maintain peace requires strength,1
2304,2004-10-08,year,0
2305,2008-10-15,talked senator mccain plan,0
2306,2000-10-17,spent last quarter century pursuit personal wealth,0
2307,1996-10-16,heard say one tv appearance medium made,0
2308,1992-10-15,child get better start pre school program smaller class early grade one aggressive adult education program country,1
2309,2000-10-17,fortunate enough earn vote also understand want open market also understand farming part national security,1
2310,2016-10-09,going defeat isi,1
2311,2004-09-30,hard work go place people get hand cut executed place people free,1
2312,2008-09-26,also ought make clear russian violation cease fire agreement,1
2313,2012-10-22,dissident street tehran green revolution holding sign saying america u president silent,0
2314,2008-09-26,china space launch space walk,0
2315,1984-10-07,called voodoo economics,0
2316,1960-09-26,want people latin america africa asia start look america see thing wonder resident united state look khrushchev look chinese communist,1
2317,1996-10-16,small business employee,0
2318,1996-10-06,generally believe president willing think right,1
2319,1988-10-13,think work together president work congress american people bring deficit steadily billion year build economic growth build good strong future america invest thing must invest economic development good job good school kid college opportunity young people decent health care affordable housing clean safe environment,1
2320,1996-10-06,serious business,1
2321,2016-10-19,around year,0
2322,1988-09-25,see funding required hope congress fully fund bill,1
2323,1960-09-26,well take bill,1
2324,1992-10-11,single parent family,1
2325,1976-09-23,say sure would fewer federal employee go office come,1
2326,2000-10-17,big state fast growing state,0
2327,2000-10-11,happen statute book hate crime statute texas,0
2328,2000-10-17,part administration finest record diversity,0
2329,2004-10-08,let start control cost health care medical liability reform starter opposed,0
2330,2016-09-26,sadly,1
2331,1960-10-21,suddenly offer congo three hundred student last june tremendous revolt,1
2332,2000-10-17,secondly enough fighting,0
2333,1960-10-13,number three pre vice president suggests keep communist doubt whether would fight quemoy matsu,1
2334,1996-10-16,mentioned washington lincoln,0
2335,2008-10-07,going telegraph punch senator obama,0
2336,2012-10-22,driven going need keep american people safe,1
2337,1996-10-16,little time left let say get attacked many time question hard answer thing,1
2338,1988-10-13,look steady negotiation may agreement remove cuban angola,1
2339,2000-10-11,anyway co sponsored mccain feingold yet,0
2340,2000-10-11,generally supported seen make call thought highly questionable,1
2341,2000-10-03,million receive,0
2342,2004-10-08,secondly course involved iran,0
2343,2004-09-30,guard foreign office might found information weapon mass destruction,0
2344,2012-10-16,president spending president borrowing cost nation raise tax american people,0
2345,2008-10-07,great honor serve many many year,0
2346,1960-09-26,fail fail move ahead fail develop sufficient military economic social strength country think uh tide could begin run u,1
2347,2008-09-26,fundamental belief goodness strength american worker,1
2348,1984-10-07,going go social security medicare student assistance handicapped last time,1
2349,2012-10-03,said going broaden base,0
2350,2012-10-16,actually got first question,0
2351,2004-10-08,like nancy reagan many people know forum michael j,0
2352,2004-10-08,really ask mistake talking,1
2353,1992-10-19,want go core problem face everybody manufacturing country agreement put practice,1
2354,1960-10-07,selected man stand field talk work,1
2355,1996-10-16,lot young people work office work campaign,0
2356,1996-10-16,far special right opposed sex marriage president signed well midnight one morning dark night,0
2357,2012-10-22,know one challenge last decade done experiment nation building place like iraq afghanistan neglected example developing economy energy sector education system,0
2358,2016-10-09,something happened,0
2359,2016-09-26,seeing b old enough father grandfather could flying,0
2360,1976-10-06,may year governor carter took first initiative approximately twelve month taken initiative year ago,0
2361,2008-10-15,well tradition local control school tradition served u well,0
2362,1992-10-15,make chart see television,0
2363,1988-10-13,protecting,1
2364,1976-10-06,original treaty signed back early theodore roosevelt president panama retained sovereignty panama canal zone,0
2365,2000-10-11,think lot time spend aid say feel better end spent wrong way pretty egregious example recently,1
2366,2004-09-30,alliance strong,1
2367,2016-09-26,going,1
2368,1980-10-28,also pursuing housing program,0
2369,2012-10-16,said would cut tax small business driver engine growth,0
2370,2016-10-09,yet know word letter c document,0
2371,1960-10-21,traveled forty eight fifty state travel learned people united state thinking,0
2372,2016-10-19,go dignity self worth think woman anywhere know feel like,1
2373,1976-09-23,believe tax equity middle income taxpayer increasing personal exemption,1
2374,2000-10-03,make number one priority,1
2375,2004-10-13,senator congressman wide choice,1
2376,2016-10-09,go hillaryclinton com,1
2377,2012-10-03,commitment education,1
2378,1988-09-25,extraordinary month kitty family,1
2379,2004-10-08,think respecting life reach cure,1
2380,2004-10-08,four year ago right forum asked question people able import drug canada,0
2381,2000-10-11,man solid judgment going person stand side,1
2382,2008-09-26,year old killed combat outside baghdad matthew stanley christmas last year,0
2383,1984-10-21,thought would simpler negotiate first,1
2384,1984-10-07,said going take work,0
2385,2008-10-07,plan fix problem got energy independence,1
2386,2012-10-16,mean mile away elli island,0
2387,2016-09-26,happen support,0
2388,1996-10-06,think,1
2389,1992-10-19,talking week got ta decide gon na president,0
2390,2000-10-03,look world war started balkan,0
2391,2004-10-13,tell people campaign trail asked laura marry said fine long never give speech,0
2392,2012-10-22,dad head car company,0
2393,2000-10-03,think well think part need cultural change,1
2394,1960-10-07,president eisenhower move scene january twentieth next four year critical year,0
2395,2008-10-15,watching ad senator mccain,0
2396,2012-10-22,going necessary,1
2397,1988-10-13,well lot campaign seems bernie go question value,1
2398,1960-09-26,support uh law united state passed order protect u uh would destroy u within,1
2399,1996-10-06,know talked jim jim lehrer pb show,0
2400,1992-10-15,pleased fraternal order police little rock arkansas endorsed think see trying strengthen anti crime legislation,0
2401,2016-09-26,numerous conversation sean hannity fox,0
2402,1980-09-21,john spoke year ago position,1
2403,1984-10-21,year administration,0
2404,1984-10-21,last debate footnote vice president united state said said marine died shamefully died shame lebanon,0
2405,2016-10-19,said look need keep eye isi,0
2406,2004-09-30,great doctrine throughout cold war,1
2407,1984-10-21,glad hear say ever since announced british parliament thought,0
2408,2016-10-09,make possible,1
2409,2004-09-30,got good strategy,1
2410,1960-10-13,suggested aid distressed area,0
2411,1960-10-07,intention field civil right spelled republican platform,0
2412,2016-10-09,happening weekly basis,0
2413,2004-10-08,chairman republican party think ought change thing,0
2414,2008-09-26,mean say agree exactly say direct contact,1
2415,1988-10-13,going carry election debate across country last whatever remains last three half week whatever answer going debate need debate,1
2416,2004-09-30,well tell exactly first want say something sanction iran,1
2417,2012-10-22,said could get private marketplace,0
2418,1984-10-07,appreciate,0
2419,2012-10-03,fourth survey done small business across country said effect obamacare hiring plan,0
2420,1960-10-13,often heard president eisenhower discussing question make statement start process indicating point point place stop threaten peace freedom world stop,0
2421,1980-09-21,think technically know difficult emotional problem many people sincerely feel side believe maybe could find answer medical evidence would determine unborn child human,1
2422,1992-10-19,promised know let say,0
2423,1992-10-19,war say well minority guess would voted majority,0
2424,1960-10-13,going going help farmer,1
2425,1996-10-06,many thing president talked turned united nation,1
2426,2008-10-07,spent whole life serving country,0
2427,1992-10-19,covered print television,0
2428,2016-10-09,one consequential election,1
2429,2016-10-19,bernie sander said bad judgment,0
2430,1980-10-28,ultimate terrorist threat fearsome part pattern country must stand firm control terrorism kind,1
2431,2000-10-03,think good opportunity bring republican democrat together reform social security system senior never go without,1
2432,1996-10-06,family tax cut,0
2433,2012-10-16,act terror also said going hunt committed crime,0
2434,2012-10-16,welcome legal immigrant country,1
2435,2004-10-08,really going war last resort,1
2436,2012-10-03,president sit day one actually day get elected sit leader democratic leader well republican leader continue state met every monday couple hour talked issue challenge state case,0
2437,1988-10-13,state saying midwestern state,0
2438,1988-09-25,yes think fine business,1
2439,2000-10-11,talked african american police officer springfield massachusetts long ago raised question said opinion one biggest solution training,0
2440,2012-10-22,well governor also fewer horse bayonet nature military changed,0
2441,2012-10-16,important,1
2442,1992-10-11,believe work ross said got plan,1
2443,2008-09-26,want every family refundable tax credit go purchase health care,1
2444,2012-10-03,favor trillion tax cut,1
2445,2000-10-17,laura proud parent teenage girl twin daughter know saying,0
2446,2016-09-26,sean hannity said strongly people willing say nobody want call,0
2447,1996-10-16,took politics,0
2448,2004-09-30,know like go one mission know around corner,1
2449,2008-10-15,energy well first second energy independence,1
2450,2012-10-03,said cut middleman,1
2451,1996-10-06,remember working senator ribicoff connecticut hospice program,0
2452,2000-10-11,bill another bill die committee,0
2453,2008-10-07,interested trying figure going impact,1
2454,1960-10-13,favored program abroad economic assistance military assistance,0
2455,2000-10-11,earned income tax credit sorry,1
2456,2016-09-26,country suffering people like secretary clinton made bad decision term job term going,1
2457,1960-10-13,believe move full time missile production particularly minuteman polaris,1
2458,1988-09-25,make concession terrorist,1
2459,2000-10-03,question,1
2460,2008-10-07,senator mccain mention,0
2461,2000-10-11,place people get primary care,0
2462,2008-09-26,important solve short term problem look underlying issue led wage income ordinary american go health care system broken energy policy working know day ago john said fundamental economy sound,0
2463,2000-10-11,already many people see strange weather condition old timer say never seen lifetime,0
2464,1980-10-28,stood south bronx exact spot president carter stood,0
2465,1988-09-25,simply going,1
2466,1976-09-23,uh republican president tried run democratic uh congress,0
2467,2000-10-03,unfortunately label certain child,0
2468,2012-10-03,grandfather died back,0
2469,2008-10-15,well look think disagreement across board spending freeze,0
2470,2008-09-26,know got plan u make significant investment next year,1
2471,2012-10-16,invested solar wind biofuels energy efficient car,0
2472,2008-10-15,mentioned health care earlier,0
2473,1996-10-16,president clinton came california,0
2474,1984-10-21,made plain second phase take submarine launched airborne missile,0
2475,1984-10-07,believe sung wedding funeral anybody ever seek presidency,0
2476,1976-09-23,uh one example instance uh somebody uh produced pornographic movie,1
2477,2000-10-17,people state behind,0
2478,2012-10-16,read account happened,0
2479,1984-10-07,got time answer regard disabled,1
2480,2004-10-08,think bad decision,1
2481,2004-10-08,got back door draft right,1
2482,2008-09-26,said let u win,0
2483,2016-10-09,lot refugee woman child think picture saw year old boy blood forehead bombed russian syrian air force,0
2484,2012-10-16,sat democrat republican beginning term,0
2485,2000-10-03,senior understand promise made promise kept younger worker understand better government trust exactly going,1
2486,1992-10-15,community college job,0
2487,2012-10-22,throughout many nation middle east,0
2488,2016-10-09,would also consider arming kurd,1
2489,1992-10-11,believe fair slap cent gallon tax whatever many year people drive living people go long distance,1
2490,1992-10-15,competitor,0
2491,2008-10-15,like love canada england,1
2492,1992-10-15,well listen ought white house day hear hear see see read mail read touch people touch time time,1
2493,1960-09-26,within administration chairman president committee price stability economic growth opportunity make recommendation adopted within administration think reasonably effective,0
2494,2012-10-22,keep going,1
2495,1988-09-25,campaign chairman secretary jim baker wife,0
2496,1988-10-13,appointed prosecutor appointed defender,0
2497,1992-10-11,got courage change,1
2498,2000-10-17,make society safest,1
2499,1992-10-19,whole world economic problem,0
2500,2004-10-08,well president expert told america question question,0
2501,2012-10-16,gone school pledged allegiance flag,1
2502,2004-09-30,told husband understood,0
2503,1960-10-13,many war history mankind,0
2504,2008-10-15,pay fine,1
2505,2004-10-08,believe america best day ahead u,1
2506,1976-09-23,uh greatly expanded white house staff,0
2507,2004-09-30,well summit held,0
2508,2000-10-17,doctor chooses prescription need nobody overrule doctor,0
2509,2004-10-08,going get training iraqi done faster,1
2510,2000-10-11,tense situation,1
2511,2012-10-03,governor romney genuinely believe care education tell student know borrow money parent go college know indicates degree know may much focus fact folk like folk like michelle kid probably attend university denver option,0
2512,2008-09-26,going employed afghanistan,1
2513,1976-10-06,south korea face delicate situation,1
2514,1992-10-19,feel strongly people go battle country,1
2515,1992-10-19,look kind know cur dog put ballot people special interest,0
2516,2004-10-13,said cincinnati would plan carefully would take every precaution,0
2517,2000-10-03,talk cutting benefit,0
2518,2012-10-22,focused china,1
2519,2008-10-15,well lot stuff put let try address,1
2520,1996-10-06,george mcgovern friend mine mean liberal proud liberal,0
2521,2004-10-08,either going destroyed left frozen,1
2522,1960-10-21,opposed drawing line know moment draw line encouragement communist attack step blackmail force war none u want,1
2523,2000-10-03,want world policeman want world peacemaker military high morale military well equipped,1
2524,2016-09-26,renegotiate trade deal,1
2525,1980-09-21,think ought get,1
2526,1996-10-16,think also strength,1
2527,2008-10-07,going spend money key issue got work,1
2528,2000-10-11,need,1
2529,2004-10-08,volunteer army work,1
2530,1992-10-19,got lot woman running office,1
2531,1992-10-19,neither anybody else far know agreed give proxy say whatever fine worker country interest country,0
2532,1984-10-21,say mutual verifiable freeze,1
2533,1992-10-11,created mess much show got fix,1
2534,2012-10-22,probably biggest whopper told course campaign,1
2535,1976-10-22,mean critical uh senator mondale uh uh surprised read uh senator mondale made derogatory personal comment general brown uh news story uh broke general brown,0
2536,1996-10-16,people look president united state person america,1
2537,1996-10-06,midnight america senator,0
2538,1960-10-13,going cost money growth help u win battle,1
2539,1996-10-16,part economic plan,0
2540,2008-10-07,going eliminate working,1
2541,2000-10-17,sir,0
2542,1960-10-21,hopeful try,1
2543,2016-10-19,started million loan,0
2544,1996-10-16,touch,0
2545,2000-10-03,going lay arm middle campaign somebody got credibility issue,1
2546,2000-10-03,campaigned since primary,0
2547,1992-10-11,invest american job american education control health care cost bring country together,1
2548,1992-10-15,think u still statue liberty symbol caring others,1
2549,1996-10-16,take politics,1
2550,2012-10-16,one point plan,0
2551,2000-10-03,think need put medicare social security lockbox,1
2552,1992-10-15,great big company buy ross got good sized company successful,0
2553,1992-10-11,lot talk family value campaign,0
2554,2000-10-17,course debate also take place time tragedy us cole mind heart insofar memorial service tomorrow would like also extend sympathy family died still missing injured,0
2555,2004-10-08,going raise tax,1
2556,2012-10-16,coal country,0
2557,2000-10-11,mean intelligent decision keep prosperity going shepherd economic strength provide leadership role,1
2558,1988-10-13,guess vice president two three time said coming left,0
2559,2004-10-08,stop outsourcing charlie,1
2560,2004-10-08,tried diplomacy went united nation,0
2561,2000-10-03,place opponent strong disagreement,0
2562,2012-10-22,inside pakistan large group pashtun taliban,0
2563,1960-10-21,eh talking castro regime eh latin america,0
2564,1960-09-26,disagree,1
2565,1960-10-21,recession fifty four,0
2566,2004-09-30,laid plan think successful iraq summit better training faster cutting need respect u n election,0
2567,2004-10-08,said whole hall said know take away hope hope keep going,0
2568,2016-09-26,got get gun hand people,1
2569,1960-10-13,see mother holding baby see man might president united state,0
2570,1996-10-16,left senate abandoned,0
2571,1996-10-06,send congress vote,0
2572,1984-10-07,seen barricade built around white house,0
2573,2012-10-16,number two investigate exactly happened regardless fact lead u make sure folk held accountable happen,1
2574,2016-10-19,feel strongly education system start preschool go college,1
2575,2004-09-30,got help u,1
2576,2012-10-03,let come back something president agree key task health care get cost affordable family,1
2577,2008-10-15,agreement status force iraq coming,1
2578,1988-10-13,public life senate congress,1
2579,2008-09-26,one adviser,0
2580,2012-10-03,want get america north america energy independent create job,1
2581,1980-09-21,think proving go forward conservation benefit,1
2582,2016-10-19,well first hear donald talk like know slogan make america great wonder thought america great,0
2583,2000-10-11,interruption way,0
2584,1976-10-06,think fairness equity recognize problem south korea,1
2585,2012-10-22,congratulate taking osama bin laden going leadership al qaeda,0
2586,2004-10-13,also former law enforcement officer,0
2587,2004-09-30,change position something fundamental believe core heart heart right iraq,1
2588,1960-10-21,far underground test developing peaceful us atomic energy allow soviet filibuster continue,1
2589,2016-09-26,far cyber agree part secretary clinton said,1
2590,1988-10-13,senator bentsen said recall debate senator quayle give u billion worth hot check year create illusion prosperity,0
2591,2004-09-30,need rebuild alliance,1
2592,2008-09-26,pipeline run caspian georgia turkey,0
2593,2012-10-16,son shot head,0
2594,2004-09-30,president said would exhaust remedy united nation go full process,0
2595,1992-10-15,tomorrow night nbc eastern going talk pay debt going come right one,0
2596,2004-10-08,senator hagel republican say know beyond pitiful beyond embarrassing zone dangerous,1
2597,1960-10-21,make judgment fifty seven fifty six fifty five fifty four outer space would important,0
2598,1988-09-25,pick lloyd bentsen clone mike dukakis,0
2599,2012-10-16,grandmother started secretary bank,0
2600,2012-10-16,wherever possible benefit two parent home always possible,1
2601,2000-10-03,could say one thing,1
2602,2000-10-17,different philosophy,1
2603,1996-10-06,believe ought running teacher attacking way republican convention,1
2604,1992-10-15,happened could work people republican democrat,0
2605,1992-10-15,american people asked get,0
2606,1992-10-15,president want get sit gridlock campaign year,1
2607,2008-10-15,example going prioritize,1
2608,2016-10-19,way donald think put know middle say know alone fix said convention stage,0
2609,2016-10-19,use people,0
2610,2012-10-16,thank hofstra university candy crowley organizing leading event,1
2611,2004-10-08,know reading good judicial decision,1
2612,2012-10-22,say governor romney criticized tough tire case said good american worker would protectionist,0
2613,2016-10-19,well aleppo disaster,1
2614,1960-10-21,simple clear,1
2615,2016-09-26,first gave name,1
2616,2016-10-19,lived arkansas wonderful year,0
2617,1984-10-21,drew manual,0
2618,2016-09-26,name alicia machado,0
2619,2016-09-26,asked question,0
2620,2008-09-26,sit ahmadinejad say going wipe israel face earth say,0
2621,1996-10-16,president historic time,0
2622,2004-09-30,stood spoke congress speaking intelligence looked make decision support authorization force,0
2623,1960-10-07,fact uh mr nixon uh discussed week ago speech,0
2624,2012-10-16,path designed getting small business grow hire people,0
2625,1988-10-13,george supply management today bill,0
2626,2000-10-11,differ arctic national wildlife refuge said,0
2627,2004-09-30,going arab summit neighborhood country,0
2628,1992-10-11,thirdly ought boot camp first time nonviolent offender get discipline treatment education get reconnected community severed sent prison learn first class criminal,1
2629,1992-10-11,plan,1
2630,1996-10-16,thing like kassebaum bill,1
2631,1984-10-21,protested suggested smaller number perhaps went along,0
2632,2008-09-26,judgment whether whether question best equipped next president make good decision use military make sure prepared ready next conflict think take look judgment,1
